film_id,title,description,release_year,language_id,original_language_id,rental_duration,rental_rate,length,replacement_cost,rating,last_update,special_features,fulltext
78,BLACKOUT PRIVATE,A Intrepid Yarn of a Pastry Chef And a Mad Scientist who must Challenge a Secret Agent in Ancient Japan,2006,1,NULL,7,2.99,85,12.99,PG,46:03.9,"{Trailers,""Deleted Scenes""}",'agent':19 'ancient':21 'blackout':1 'challeng':16 'chef':9 'intrepid':4 'japan':22 'mad':12 'must':15 'pastri':8 'privat':2 'scientist':13 'secret':18 'yarn':5
79,BLADE POLISH,A Thoughtful Character Study of a Frisbee And a Pastry Chef who must Fight a Dentist in The First Manned Space Station,2006,1,NULL,5,0.99,114,10.99,PG-13,46:03.9,"{Trailers,""Behind the Scenes""}",'blade':1 'charact':5 'chef':13 'dentist':18 'fight':16 'first':21 'frisbe':9 'man':22 'must':15 'pastri':12 'polish':2 'space':23 'station':24 'studi':6 'thought':4
80,BLANKET BEVERLY,A Emotional Documentary of a Student And a Girl who must Build a Boat in Nigeria,2006,1,NULL,7,2.99,148,21.99,G,46:03.9,{Trailers},'bever':2 'blanket':1 'boat':16 'build':14 'documentari':5 'emot':4 'girl':11 'must':13 'nigeria':18 'student':8
81,BLINDNESS GUN,A Touching Drama of a Robot And a Dentist who must Meet a Hunter in A Jet Boat,2006,1,NULL,6,4.99,103,29.99,PG-13,46:03.9,"{Trailers,""Behind the Scenes""}",'blind':1 'boat':20 'dentist':11 'drama':5 'gun':2 'hunter':16 'jet':19 'meet':14 'must':13 'robot':8 'touch':4
82,BLOOD ARGONAUTS,A Boring Drama of a Explorer And a Man who must Kill a Lumberjack in A Manhattan Penthouse,2006,1,NULL,3,0.99,71,13.99,G,46:03.9,"{Trailers,Commentaries,""Behind the Scenes""}",'argonaut':2 'blood':1 'bore':4 'drama':5 'explor':8 'kill':14 'lumberjack':16 'man':11 'manhattan':19 'must':13 'penthous':20
83,BLUES INSTINCT,A Insightful Documentary of a Boat And a Composer who must Meet a Forensic Psychologist in An Abandoned Fun House,2006,1,NULL,5,2.99,50,18.99,G,46:03.9,"{Trailers,""Deleted Scenes"",""Behind the Scenes""}",'abandon':20 'blue':1 'boat':8 'compos':11 'documentari':5 'forens':16 'fun':21 'hous':22 'insight':4 'instinct':2 'meet':14 'must':13 'psychologist':17
84,BOILED DARES,A Awe-Inspiring Story of a Waitress And a Dog who must Discover a Dentist in Ancient Japan,2006,1,NULL,7,4.99,102,13.99,PG,46:03.9,"{Trailers,Commentaries}",'ancient':20 'awe':5 'awe-inspir':4 'boil':1 'dare':2 'dentist':18 'discov':16 'dog':13 'inspir':6 'japan':21 'must':15 'stori':7 'waitress':10
85,BONNIE HOLOCAUST,A Fast-Paced Story of a Crocodile And a Robot who must Find a Moose in Ancient Japan,2006,1,NULL,4,0.99,63,29.99,G,46:03.9,"{""Deleted Scenes""}",'ancient':20 'bonni':1 'crocodil':10 'fast':5 'fast-pac':4 'find':16 'holocaust':2 'japan':21 'moos':18 'must':15 'pace':6 'robot':13 'stori':7
86,BOOGIE AMELIE,A Lacklusture Character Study of a Husband And a Sumo Wrestler who must Succumb a Technical Writer in The Gulf of Mexico,2006,1,NULL,6,4.99,121,11.99,R,46:03.9,"{Commentaries,""Behind the Scenes""}",'ameli':2 'boogi':1 'charact':5 'gulf':22 'husband':9 'lacklustur':4 'mexico':24 'must':15 'studi':6 'succumb':16 'sumo':12 'technic':18 'wrestler':13 'writer':19
87,BOONDOCK BALLROOM,A Fateful Panorama of a Crocodile And a Boy who must Defeat a Monkey in The Gulf of Mexico,2006,1,NULL,7,0.99,76,14.99,NC-17,46:03.9,"{""Behind the Scenes""}",'ballroom':2 'boondock':1 'boy':11 'crocodil':8 'defeat':14 'fate':4 'gulf':19 'mexico':21 'monkey':16 'must':13 'panorama':5
88,BORN SPINAL,A Touching Epistle of a Frisbee And a Husband who must Pursue a Student in Nigeria,2006,1,NULL,7,4.99,179,17.99,PG,46:03.9,"{Trailers,Commentaries,""Deleted Scenes""}",'born':1 'epistl':5 'frisbe':8 'husband':11 'must':13 'nigeria':18 'pursu':14 'spinal':2 'student':16 'touch':4
89,BORROWERS BEDAZZLED,A Brilliant Epistle of a Teacher And a Sumo Wrestler who must Defeat a Man in An Abandoned Fun House,2006,1,NULL,7,0.99,63,22.99,G,46:03.9,"{Commentaries,""Deleted Scenes"",""Behind the Scenes""}",'abandon':20 'bedazzl':2 'borrow':1 'brilliant':4 'defeat':15 'epistl':5 'fun':21 'hous':22 'man':17 'must':14 'sumo':11 'teacher':8 'wrestler':12
90,BOULEVARD MOB,A Fateful Epistle of a Moose And a Monkey who must Confront a Lumberjack in Ancient China,2006,1,NULL,3,0.99,63,11.99,R,46:03.9,{Trailers},'ancient':18 'boulevard':1 'china':19 'confront':14 'epistl':5 'fate':4 'lumberjack':16 'mob':2 'monkey':11 'moos':8 'must':13
91,BOUND CHEAPER,A Thrilling Panorama of a Database Administrator And a Astronaut who must Challenge a Lumberjack in A Baloon,2006,1,NULL,5,0.99,98,17.99,PG,46:03.9,"{""Behind the Scenes""}",'administr':9 'astronaut':12 'baloon':20 'bound':1 'challeng':15 'cheaper':2 'databas':8 'lumberjack':17 'must':14 'panorama':5 'thrill':4
92,BOWFINGER GABLES,A Fast-Paced Yarn of a Waitress And a Composer who must Outgun a Dentist in California,2006,1,NULL,7,4.99,72,19.99,NC-17,46:03.9,"{Trailers,""Deleted Scenes""}",'bowfing':1 'california':20 'compos':13 'dentist':18 'fast':5 'fast-pac':4 'gabl':2 'must':15 'outgun':16 'pace':6 'waitress':10 'yarn':7
93,BRANNIGAN SUNRISE,A Amazing Epistle of a Moose And a Crocodile who must Outrace a Dog in Berlin,2006,1,NULL,4,4.99,121,27.99,PG,46:03.9,{Trailers},'amaz':4 'berlin':18 'brannigan':1 'crocodil':11 'dog':16 'epistl':5 'moos':8 'must':13 'outrac':14 'sunris':2
94,BRAVEHEART HUMAN,A Insightful Story of a Dog And a Pastry Chef who must Battle a Girl in Berlin,2006,1,NULL,7,2.99,176,14.99,PG-13,46:03.9,"{Trailers,""Deleted Scenes""}",'battl':15 'berlin':19 'braveheart':1 'chef':12 'dog':8 'girl':17 'human':2 'insight':4 'must':14 'pastri':11 'stori':5
95,BREAKFAST GOLDFINGER,A Beautiful Reflection of a Student And a Student who must Fight a Moose in Berlin,2006,1,NULL,5,4.99,123,18.99,G,46:03.9,"{Trailers,Commentaries,""Deleted Scenes""}","'beauti':4 'berlin':18 'breakfast':1 'fight':14 'goldfing':2 'moos':16 'must':13 'reflect':5 'student':8,11"
96,BREAKING HOME,A Beautiful Display of a Secret Agent And a Monkey who must Battle a Sumo Wrestler in An Abandoned Mine Shaft,2006,1,NULL,4,2.99,169,21.99,PG-13,46:03.9,"{Trailers,Commentaries}",'abandon':21 'agent':9 'battl':15 'beauti':4 'break':1 'display':5 'home':2 'mine':22 'monkey':12 'must':14 'secret':8 'shaft':23 'sumo':17 'wrestler':18
97,BRIDE INTRIGUE,A Epic Tale of a Robot And a Monkey who must Vanquish a Man in New Orleans,2006,1,NULL,7,0.99,56,24.99,G,46:03.9,"{Trailers,Commentaries,""Behind the Scenes""}",'bride':1 'epic':4 'intrigu':2 'man':16 'monkey':11 'must':13 'new':18 'orlean':19 'robot':8 'tale':5 'vanquish':14
98,BRIGHT ENCOUNTERS,A Fateful Yarn of a Lumberjack And a Feminist who must Conquer a Student in A Jet Boat,2006,1,NULL,4,4.99,73,12.99,PG-13,46:03.9,{Trailers},'boat':20 'bright':1 'conquer':14 'encount':2 'fate':4 'feminist':11 'jet':19 'lumberjack':8 'must':13 'student':16 'yarn':5
99,BRINGING HYSTERICAL,A Fateful Saga of a A Shark And a Technical Writer who must Find a Woman in A Jet Boat,2006,1,NULL,7,2.99,136,14.99,PG,46:03.9,{Trailers},'boat':22 'bring':1 'fate':4 'find':16 'hyster':2 'jet':21 'must':15 'saga':5 'shark':9 'technic':12 'woman':18 'writer':13
100,BROOKLYN DESERT,A Beautiful Drama of a Dentist And a Composer who must Battle a Sumo Wrestler in The First Manned Space Station,2006,1,NULL,7,4.99,161,21.99,R,46:03.9,{Commentaries},'battl':14 'beauti':4 'brooklyn':1 'compos':11 'dentist':8 'desert':2 'drama':5 'first':20 'man':21 'must':13 'space':22 'station':23 'sumo':16 'wrestler':17
